{"$schema":"https://json-schema.org/draft/2020-12/schema","title":"SourcePolicy","description":"`SourcePolicy`: the plan’s strict wire record.","type":"object","properties":{"acquisition_profiles":{"description":"Declared `acquisition_profiles`; no inferred default.","type":"array","items":{"$ref":"#/$defs/PolicyReference"},"maxItems":1000,"minItems":1},"adaptation":{"description":"Declared `adaptation`; no inferred default.","$ref":"#/$defs/AdaptationPolicy"},"address_table":{"description":"Declared `address_table`; no inferred default.","$ref":"#/$defs/PolicyReference"},"aggregate_limits":{"description":"Declared `aggregate_limits`; no inferred default.","$ref":"#/$defs/Limits"},"collection_id":{"description":"Declared `collection_id`; no inferred default.","type":"string","maxLength":128,"minLength":1,"pattern":"^[A-Za-z0-9][A-Za-z0-9_.-]*$"},"id":{"description":"Declared `id`; no inferred default.","type":"string","maxLength":128,"minLength":1,"pattern":"^[A-Za-z0-9][A-Za-z0-9_.-]*$"},"owner_ref":{"description":"Declared `owner_ref`; no inferred default.","$ref":"#/$defs/PolicyReference"},"profiles":{"description":"Declared `profiles`; no inferred default.","$ref":"#/$defs/PolicyReference"},"qualification":{"description":"Declared `qualification`; no inferred default.","$ref":"#/$defs/PolicyReference"},"registries":{"description":"Declared `registries`; no inferred default.","type":"array","items":{"$ref":"#/$defs/PolicyReference"},"maxItems":10000},"retention_rule":{"description":"Declared `retention_rule`; no inferred default.","$ref":"#/$defs/PolicyReference"},"schema":{"description":"Declared `schema`; no inferred default.","$ref":"#/$defs/PolicySchema"},"scope_tags":{"description":"Declared `scope_tags`; no inferred default.","type":"array","items":{"type":"string"},"maxItems":10000},"sources":{"description":"Declared `sources`; no inferred default.","type":"array","items":{"$ref":"#/$defs/Source"},"maxItems":1000,"minItems":1},"version":{"description":"Declared `version`; no inferred default.","type":"integer","format":"uint64","minimum":1},"visibility":{"description":"Declared `visibility`; no inferred default.","$ref":"#/$defs/Visibility"}},"additionalProperties":false,"required":["schema","id","version","collection_id","visibility","scope_tags","owner_ref","sources","registries","profiles","acquisition_profiles","address_table","aggregate_limits","adaptation","retention_rule","qualification"],"$defs":{"AdaptationPolicy":{"description":"`AdaptationPolicy`: the plan’s strict wire record.","type":"object","properties":{"activation_interval_ms":{"description":"Declared `activation_interval_ms`; no inferred default.","type":"integer","format":"uint64","minimum":1},"automatic_classes":{"description":"Declared `automatic_classes`; no inferred default.","type":"array","items":{"$ref":"#/$defs/AutomaticClass"},"maxItems":10000},"baseline":{"description":"Declared `baseline`; no inferred default.","$ref":"#/$defs/PolicyReference"},"consecutive_runs":{"description":"Declared `consecutive_runs`; no inferred default.","type":"integer","format":"uint64","minimum":1},"matrix":{"description":"Declared `matrix`; no inferred default.","$ref":"#/$defs/PolicyReference"},"minimum_sample":{"description":"Declared `minimum_sample`; no inferred default.","type":"integer","format":"uint64","minimum":1},"thresholds":{"description":"Declared `thresholds`; no inferred default.","$ref":"#/$defs/PolicyReference"}},"additionalProperties":false,"required":["matrix","thresholds","baseline","minimum_sample","consecutive_runs","activation_interval_ms","automatic_classes"]},"AutomaticClass":{"description":"The closed set of `AutomaticClass` values.","oneOf":[{"description":"`selected_profiles`.","type":"string","const":"selected_profiles"},{"description":"`cleanup`.","type":"string","const":"cleanup"},{"description":"`s1_chunk_strategy`.","type":"string","const":"s1_chunk_strategy"},{"description":"`dedup_keys`.","type":"string","const":"dedup_keys"},{"description":"`new_knowledge_exclusions`.","type":"string","const":"new_knowledge_exclusions"}]},"DecodeLimits":{"description":"`DecodeLimits`: the plan’s strict wire record.","type":"object","properties":{"decoded_pixels":{"description":"Declared `decoded_pixels`; no inferred default.","type":"integer","format":"uint64","minimum":1},"elapsed_ms":{"description":"Declared `elapsed_ms`; no inferred default.","type":"integer","format":"uint64","minimum":1},"expanded_bytes":{"description":"Declared `expanded_bytes`; no inferred default.","type":"integer","format":"uint64","minimum":1},"expansion_ratio":{"description":"Declared `expansion_ratio`; no inferred default.","type":"integer","format":"uint64","minimum":1},"members":{"description":"Declared `members`; no inferred default.","type":"integer","format":"uint64","minimum":1},"memory_bytes":{"description":"Declared `memory_bytes`; no inferred default.","type":"integer","format":"uint64","minimum":1},"nested_levels":{"description":"Declared `nested_levels`; no inferred default.","type":"integer","format":"uint64","minimum":1},"xml_entities":{"description":"Declared `xml_entities`; no inferred default.","$ref":"#/$defs/XmlEntities"}},"additionalProperties":false,"required":["expanded_bytes","expansion_ratio","nested_levels","members","decoded_pixels","elapsed_ms","memory_bytes","xml_entities"]},"Discovery":{"description":"Declarative Discovery; unknown predicates refuse.","oneOf":[{"description":"`links`.","type":"object","properties":{"depth":{"description":"Explicit `depth`.","type":"integer","format":"uint64","minimum":1},"kind":{"type":"string","const":"links"}},"additionalProperties":false,"required":["kind","depth"]},{"description":"`sitemap`.","type":"object","properties":{"kind":{"type":"string","const":"sitemap"},"url":{"description":"Explicit `url`.","type":"string"}},"additionalProperties":false,"required":["kind","url"]},{"description":"`api`.","type":"object","properties":{"kind":{"type":"string","const":"api"},"mapping":{"description":"Explicit `mapping`.","$ref":"#/$defs/PolicyReference"}},"additionalProperties":false,"required":["kind","mapping"]},{"description":"`repository`.","type":"object","properties":{"kind":{"type":"string","const":"repository"},"large_files":{"description":"Explicit `large_files`.","type":"array","items":{"type":"string"}},"owner":{"description":"Explicit `owner`.","type":"string"},"paths":{"description":"Explicit `paths`.","type":"array","items":{"type":"string"}},"ref":{"description":"Explicit `r#ref`.","type":"string"},"repository":{"description":"Explicit `repository`.","type":"string"},"submodules":{"description":"Explicit `submodules`.","type":"array","items":{"type":"string"}}},"additionalProperties":false,"required":["kind","owner","repository","ref","paths","submodules","large_files"]}]},"Fragment":{"description":"The closed set of Fragment values.","oneOf":[{"description":"`discard_for_fetch`.","type":"string","const":"discard_for_fetch"}]},"IdentityRule":{"description":"`IdentityRule`: the plan’s strict wire record.","type":"object","properties":{"fragment":{"description":"Declared `fragment`; no inferred default.","$ref":"#/$defs/Fragment"},"ignored_tracking_queries":{"description":"Declared `ignored_tracking_queries`; no inferred default.","type":"array","items":{"type":"string"},"maxItems":10000},"meaningful_queries":{"description":"Declared `meaningful_queries`; no inferred default.","type":"array","items":{"type":"string"},"maxItems":10000},"migration":{"description":"Declared `migration`; no inferred default.","anyOf":[{"$ref":"#/$defs/PolicyReference"},{"type":"null"}]},"query_order":{"description":"Declared `query_order`; no inferred default.","$ref":"#/$defs/QueryOrder"},"repeated_queries":{"description":"Declared `repeated_queries`; no inferred default.","$ref":"#/$defs/RepeatedQueries"},"version":{"description":"Declared `version`; no inferred default.","type":"integer","format":"uint64","minimum":1}},"additionalProperties":false,"required":["version","meaningful_queries","ignored_tracking_queries","query_order","repeated_queries","fragment","migration"]},"Limits":{"description":"Limits: the plan’s strict wire record.","type":"object","properties":{"asset_bytes":{"description":"Declared `asset_bytes`; no inferred default.","type":"integer","format":"uint64","minimum":1},"cpu_millicores":{"description":"Declared `cpu_millicores`; no inferred default.","type":"integer","format":"uint64","minimum":1},"decode":{"description":"Declared `decode`; no inferred default.","$ref":"#/$defs/DecodeLimits"},"depth":{"description":"Declared `depth`; no inferred default.","type":"integer","format":"uint64","minimum":1},"dom_bytes":{"description":"Declared `dom_bytes`; no inferred default.","type":"integer","format":"uint64","minimum":1},"elapsed_ms":{"description":"Declared `elapsed_ms`; no inferred default.","type":"integer","format":"uint64","minimum":1},"free_reserve_bytes":{"description":"Declared `free_reserve_bytes`; no inferred default.","type":"integer","format":"uint64","minimum":1},"gpu_batches":{"description":"Declared `gpu_batches`; no inferred default.","type":"integer","format":"uint64","minimum":0},"gpu_bytes":{"description":"Declared `gpu_bytes`; no inferred default.","type":"integer","format":"uint64","minimum":0},"gpu_reserve_bytes":{"description":"Declared `gpu_reserve_bytes`; no inferred default.","type":"integer","format":"uint64","minimum":1},"max_backoff_ms":{"description":"Declared `max_backoff_ms`; no inferred default.","type":"integer","format":"uint64","minimum":0},"memory_bytes":{"description":"Declared `memory_bytes`; no inferred default.","type":"integer","format":"uint64","minimum":1},"origin_concurrency":{"description":"Declared `origin_concurrency`; no inferred default.","type":"integer","format":"uint64","minimum":1},"origin_interval_ms":{"description":"Declared `origin_interval_ms`; no inferred default.","type":"integer","format":"uint64","minimum":1},"pages":{"description":"Declared `pages`; no inferred default.","type":"integer","format":"uint64","minimum":1},"partitions":{"description":"Declared `partitions`; no inferred default.","type":"integer","format":"uint64","minimum":1},"redirects":{"description":"Declared `redirects`; no inferred default.","type":"integer","format":"uint64","minimum":1},"requests":{"description":"Declared `requests`; no inferred default.","type":"integer","format":"uint64","minimum":1},"retries":{"description":"Declared `retries`; no inferred default.","type":"integer","format":"uint64","minimum":0},"source_runs":{"description":"Declared `source_runs`; no inferred default.","type":"integer","format":"uint64","minimum":1},"staging_bytes":{"description":"Declared `staging_bytes`; no inferred default.","type":"integer","format":"uint64","minimum":1},"wire_bytes":{"description":"Raw bytes read after the final header CRLFCRLF: DATA, chunk framing and trailers.\nEncoded response `wire_body` remains DATA-only. No inferred default.","type":"integer","format":"uint64","minimum":1}},"additionalProperties":false,"required":["requests","pages","partitions","redirects","depth","elapsed_ms","wire_bytes","dom_bytes","asset_bytes","staging_bytes","cpu_millicores","memory_bytes","source_runs","origin_concurrency","free_reserve_bytes","gpu_reserve_bytes","origin_interval_ms","retries","max_backoff_ms","gpu_batches","gpu_bytes","decode"]},"Origin":{"description":"Origin: the plan’s strict wire record.","type":"object","properties":{"host":{"description":"Declared `host`; no inferred default.","type":"string"},"id":{"description":"Declared `id`; no inferred default.","type":"string","maxLength":128,"minLength":1,"pattern":"^[A-Za-z0-9][A-Za-z0-9_.-]*$"},"path_prefixes":{"description":"Declared path prefixes; escapes store uppercase hex, unreserved escapes refuse.","type":"array","items":{"type":"string"},"maxItems":10000},"port":{"description":"Declared `port`; no inferred default.","type":"integer","format":"uint16","maximum":65535,"minimum":1},"private_grant":{"description":"Declared `private_grant`; no inferred default.","type":["string","null"]},"purpose":{"description":"Declared `purpose`; no inferred default.","$ref":"#/$defs/Purpose"},"scheme":{"description":"Declared `scheme`; no inferred default.","$ref":"#/$defs/Scheme"}},"additionalProperties":false,"required":["id","scheme","host","port","path_prefixes","purpose","private_grant"]},"PolicyReference":{"description":"A source-policy resource identity, not a path or an access grant.","type":"object","properties":{"digest":{"description":"Exact immutable SHA-256 resource digest.","type":"string","pattern":"^[0-9a-f]{64}$"},"id":{"description":"Logical resource identifier, validated by the source-policy resolver.","type":"string","maxLength":128,"minLength":1,"pattern":"^[A-Za-z0-9][A-Za-z0-9_.-]*$"}},"additionalProperties":false,"required":["id","digest"]},"PolicySchema":{"description":"The executable source-policy version.","oneOf":[{"description":"Version one only.","type":"string","const":"maestro-source-policy/1"}]},"Purpose":{"description":"The closed set of Purpose values.","oneOf":[{"description":"`content`.","type":"string","const":"content"},{"description":"`authentication`.","type":"string","const":"authentication"},{"description":"`asset`.","type":"string","const":"asset"}]},"QueryOrder":{"description":"The closed set of `QueryOrder` values.","oneOf":[{"description":"`preserve`.","type":"string","const":"preserve"},{"description":"`sort`.","type":"string","const":"sort"}]},"RepeatedQueries":{"description":"The closed set of `RepeatedQueries` values.","oneOf":[{"description":"`preserve`.","type":"string","const":"preserve"},{"description":"`reject`.","type":"string","const":"reject"}]},"Robots":{"description":"Robots: the plan’s strict wire record.","type":"object","properties":{"agent":{"description":"Declared `agent`; no inferred default.","type":"string","maxLength":4096},"cache_ttl_ms":{"description":"Declared `cache_ttl_ms`; no inferred default.","type":"integer","format":"uint64","minimum":1},"override":{"description":"Declared `r#override`; no inferred default.","anyOf":[{"$ref":"#/$defs/PolicyReference"},{"type":"null"}]},"rules_max_bytes":{"description":"Declared `rules_max_bytes`; no inferred default.","type":"integer","format":"uint64","minimum":1}},"additionalProperties":false,"required":["agent","override","rules_max_bytes","cache_ttl_ms"]},"Scheme":{"description":"The closed set of Scheme values.","oneOf":[{"description":"`https`.","type":"string","const":"https"}]},"Selector":{"description":"Selector: the plan’s strict wire record.","type":"object","properties":{"channels":{"description":"Declared `channels`; no inferred default.","type":"array","items":{"type":"string"},"maxItems":10000},"media_types":{"description":"Declared `media_types`; no inferred default.","type":"array","items":{"type":"string"},"maxItems":10000},"object_ids":{"description":"Declared `object_ids`; no inferred default.","type":"array","items":{"type":"string"},"maxItems":10000},"origin":{"description":"Declared `origin`; no inferred default.","type":["string","null"]},"path_prefix":{"description":"Declared path prefix; escapes store uppercase hex, unreserved escapes refuse.","type":["string","null"]},"source_id":{"description":"Declared `source_id`; no inferred default.","type":"string","maxLength":128,"minLength":1,"pattern":"^[A-Za-z0-9][A-Za-z0-9_.-]*$"},"versions":{"description":"Declared `versions`; no inferred default.","type":"array","items":{"type":"string"},"maxItems":10000}},"additionalProperties":false,"required":["source_id","origin","path_prefix","object_ids","versions","channels","media_types"]},"Source":{"description":"Source: the plan’s strict wire record.","type":"object","properties":{"acquisition_profile":{"description":"Declared `acquisition_profile`; no inferred default.","$ref":"#/$defs/PolicyReference"},"auth_role":{"description":"Declared `auth_role`; no inferred default.","type":["string","null"]},"connector":{"description":"Declared `connector`; no inferred default.","anyOf":[{"$ref":"#/$defs/PolicyReference"},{"type":"null"}]},"decisions":{"description":"Declared `decisions`; no inferred default.","type":"array","items":{"$ref":"#/$defs/PolicyReference"},"maxItems":10000},"discovery":{"description":"Declared `discovery`; no inferred default.","type":"array","items":{"$ref":"#/$defs/Discovery"},"maxItems":10000},"id":{"description":"Declared `id`; no inferred default.","type":"string","maxLength":128,"minLength":1,"pattern":"^[A-Za-z0-9][A-Za-z0-9_.-]*$"},"identity":{"description":"Declared `identity`; no inferred default.","$ref":"#/$defs/IdentityRule"},"limits":{"description":"Declared `limits`; no inferred default.","$ref":"#/$defs/Limits"},"origins":{"description":"Declared `origins`; no inferred default.","type":"array","items":{"$ref":"#/$defs/Origin"},"maxItems":10000},"promotions":{"description":"Declared `promotions`; no inferred default.","type":"array","items":{"$ref":"#/$defs/PolicyReference"},"maxItems":10000},"robots":{"description":"Declared `robots`; no inferred default.","$ref":"#/$defs/Robots"},"seeds":{"description":"Declared `seeds`; no inferred default.","type":"array","items":{"type":"string"},"maxItems":10000},"selected_profiles":{"description":"Declared `selected_profiles`; no inferred default.","type":"array","items":{"$ref":"#/$defs/PolicyReference"},"maxItems":10000},"selectors":{"description":"Declared `selectors`; no inferred default.","type":"array","items":{"$ref":"#/$defs/Selector"},"maxItems":10000},"sync":{"description":"Declared `sync`; no inferred default.","$ref":"#/$defs/SyncPolicy"},"wiki_mapping":{"description":"Declared `wiki_mapping`; no inferred default.","anyOf":[{"$ref":"#/$defs/PolicyReference"},{"type":"null"}]}},"additionalProperties":false,"required":["id","origins","seeds","discovery","selectors","decisions","promotions","robots","limits","identity","auth_role","connector","wiki_mapping","acquisition_profile","selected_profiles","sync"]},"SyncMode":{"description":"The closed set of `SyncMode` values.","oneOf":[{"description":"`manual`.","type":"string","const":"manual"},{"description":"`one_off`.","type":"string","const":"one_off"},{"description":"`watch`.","type":"string","const":"watch"}]},"SyncPolicy":{"description":"`SyncPolicy`: the plan’s strict wire record.","type":"object","properties":{"clock_skew_ms":{"description":"Declared `clock_skew_ms`; no inferred default.","type":"integer","format":"uint64","minimum":0},"mode":{"description":"Declared `mode`; no inferred default.","$ref":"#/$defs/SyncMode"},"overlap_ms":{"description":"Declared `overlap_ms`; no inferred default.","type":"integer","format":"uint64","minimum":0},"revision_fields":{"description":"Declared `revision_fields`; no inferred default.","type":"array","items":{"type":"string"},"maxItems":10000},"timer_period_ms":{"description":"Declared `timer_period_ms`; no inferred default.","type":["integer","null"],"format":"uint64","minimum":1}},"additionalProperties":false,"required":["mode","timer_period_ms","overlap_ms","clock_skew_ms","revision_fields"]},"Visibility":{"description":"The closed set of Visibility values.","oneOf":[{"description":"`public`.","type":"string","const":"public"},{"description":"`private`.","type":"string","const":"private"}]},"XmlEntities":{"description":"The closed set of `XmlEntities` values.","oneOf":[{"description":"`disabled`.","type":"string","const":"disabled"}]}}}
